{
  "$schema": "http://json-schema.org/draft-07/schema#",
  "type": "object",
  "required": ["id","official_name","alt_names","address","city","region","country","postcode","lat","lng","website","email","telephone","not_open_to_public"],
  "additionalProperties": false,
  "properties": {
    "id": {"type": "string", "pattern": "^[a-z0-9-]+$"},
    "official_name": {"type": "string", "minLength": 1},
    "alt_names": {"type": "array", "items": {"type": "string"}},
    "address": {"type": ["string","null"]},
    "city": {"type": ["string","null"]},
    "region": {"type": ["string","null"]},
    "country": {"type": ["string","null"]},
    "postcode": {"type": ["string","null"]},
    "lat": {"type": ["number","null"]},
    "lng": {"type": ["number","null"]},
    "website": {"type": ["string","null"]},
    "email": {"type": ["string","null"]},
    "telephone": {"type": ["string","null"]},
    "not_open_to_public": {"type": "boolean"}
  }
}
